### ISSUE TITLE
sometimes the error should be "tcp read xxx->xx i/o read timeout", but give me a  ErrConnectionClosed  error .

### ISSUE THREAD

**Issue by goith** [valyala/fasthttp#355]
```
func (h *ResponseHeader) tryRead(r *bufio.Reader, n int) error {
        h.resetSkipNormalize()
	b, err := r.Peek(n)
	if len(b) == 0 {
		// treat all errors on the first byte read as EOF
		if n == 1 || err == io.EOF {
//i think it need improve.
			return io.EOF
		}

```

**Comment by kirillDanshin** [comment]
@goith can you please clarify your question?

**Comment by detailyang** [comment]
tryRead will eat the timeout error:

**Comment by skiloop** [comment]
I face the same problem.
When I make http request with fasthttp, the client wait to read data from the server until timeout, fasthttp take this as an ErrConnectionClosed. In fact it the client that closes the connection. It's a bit misleading to warn ErrConnectionClosed in this case.

**Comment by roman-khimov** [comment]
This one is still present in v1.8.0, timeouted requests return an `ErrConnectionClosed` error which is misleading and very annoying. The error looks like this in logs:
```
2020/01/27 14:30:47 error after calling rpc server the server closed connection before returning the first response byte. Make sure the server returns 'Connection: close' response header before closing the connection
```
But what happens on the wire is this (`172.30.0.6.20331` is the address of the server):
```
14:30:17.977792 IP (tos 0x0, ttl 64, id 31622, offset 0, flags [DF], proto TCP (6), length 555)
    172.30.0.7.49110 > 172.30.0.6.20331: Flags [P.], cksum 0x5a67 (incorrect -> 0x65a8), seq 86517:87020, ack 28026, win 722, options [nop,nop,TS val 1682293687 ecr 3959358068], length 503
E..+{.@.@.d...........OkN^IV.&.}....Zg.....
dE.....tPOST / HTTP/1.1
User-Agent: fasthttp
Host: go-node:20331
Content-Type: application/json; charset=utf-8
Content-Length: 373

{"jsonrpc": "2.0", "id": 1, "method": "sendrawtransaction", "params": ["d1000151029010000000000001200b0000000000000000207cf6da97196affc31d7ea416c1e9a9baaf49128f0000014140fd56166a32767c703ba5dcbccd899e7f387ffc8ea718e6f5f3ecd3011668668ad49cb6c86d852be3c615ff52025a14c6d59ad86875aa9592a441e2f3a0b933be232103428aa0e
d0d97b4d7702523963e2d1b0fe0ada638757ba31f7ef1308c806c2639ac"]}
14:30:17.977845 IP (tos 0x0, ttl 64, id 59329, offset 0, flags [DF], proto TCP (6), length 52)
    172.30.0.6.20331 > 172.30.0.7.49110: Flags [.], cksum 0x5870 (incorrect -> 0x769b), seq 28026, ack 87020, win 726, options [nop,nop,TS val 3959358068 ecr 1682293687], length 0
E..4..@.@...........Ok...&.}N^KM....Xp.....
...tdE..
...
14:30:32.982302 IP (tos 0x0, ttl 64, id 59330, offset 0, flags [DF], proto TCP (6), length 52)
    172.30.0.6.20331 > 172.30.0.7.49110: Flags [.], cksum 0x5870 (incorrect -> 0x3c00), seq 28025, ack 87020, win 726, options [nop,nop,TS val 3959373072 ecr 1682293687], length 0
E..4..@.@...........Ok...&.|N^KM....Xp.....
..=.dE..
...
14:30:32.982340 IP (tos 0x0, ttl 64, id 31623, offset 0, flags [DF], proto TCP (6), length 52)
    172.30.0.7.49110 > 172.30.0.6.20331: Flags [.], cksum 0x5870 (incorrect -> 0x3c03), seq 87020, ack 28026, win 722, options [nop,nop,TS val 1682308691 ecr 3959358068], length 0
E..4{.@.@.f...........OkN^KM.&.}....Xp.....
dE.S...t
...
14:30:47.977990 IP (tos 0x0, ttl 64, id 31624, offset 0, flags [DF], proto TCP (6), length 52)
    172.30.0.7.49110 > 172.30.0.6.20331: Flags [F.], cksum 0x5870 (incorrect -> 0x016e), seq 87020, ack 28026, win 722, options [nop,nop,TS val 1682323687 ecr 3959358068], length 0
E..4{.@.@.f...........OkN^KM.&.}....Xp.....
dF8....t
```
Notice that it's the client that sends a FIN and closes the connection, not the server.

@erikdubbelboer, please reopen it. I think there should be another error like `ErrTimeout` for this particular case.

**Comment by erikdubbelboer** [comment]
@roman-khimov I agree this is wrong. I have made a pull request to fix this. If you want you can review it: https://github.com/valyala/fasthttp/pull/736
